{
  "health": [
    {
      "resourceType": "Observation",
      "code": {
        "coding": [
          {
            "system": "http://loinc.org",
            "code": "80404-7",
            "display": "R-R interval.standard deviation (Heart rate variability)"
          }
        ]
      },
      "valueQuantity": {
        "value": 45,
        "unit": "ms"
      },
      "effectiveDateTime": "2023-10-27T08:00:00Z"
    }
  ],
  "workouts": [
    {
      "workout_id": "hevy-123",
      "name": "Leg Day",
      "start_time": "2023-10-27T17:00:00Z",
      "end_time": "2023-10-27T18:30:00Z",
      "volume_kg": 15000,
      "rpe": 9
    }
  ],
  "calendar": [
    {
      "event_id": "cal-123",
      "summary": "Project Sync",
      "start_time": "2023-10-27T10:00:00Z",
      "end_time": "2023-10-27T11:00:00Z",
      "is_busy": true
    }
  ],
  "finance": [
    {
      "transaction_id": "fin-123",
      "amount": 45.5,
      "currency": "USD",
      "category": "Dining",
      "date": "2023-10-27T20:00:00Z",
      "type": "expense"
    }
  ]
}

